{
  "requestId": "req-reference-001",
  "requestType": "CREATE_DESIGN_FROM_REFERENCE",
  "fileKey": "abc123defREF",
  "screens": [
    {
      "pageId": "emp-list",
      "screenName": null,
      "textPrompt": null,
      "referenceFileKey": "abc123defREF",
      "referenceNodeId": "12:34",
      "imageAssetRef": null,
      "requiredComponentLogicalTypes": [],
      "targetPlatform": null,
      "existingScreenId": null
    }
  ],
  "snapshotRef": {
    "profileId": "krds",
    "profileVersion": "1.0",
    "registryVersion": "2026.07",
    "layoutPolicyVersion": null
  },
  "requestedAt": "2026-08-02T09:00:00Z"
}
